{
  "record_id": "SOURCE_REFRESH_RECORD_VM_CLAIM_004",
  "classification": "INTERNAL_ONLY",
  "publication_status": "do_not_publish",
  "execution_status": "not_authorized",
  "record_status": "reviewed_no_claim_upgrade",
  "claim_id": "VM-CLAIM-004",
  "exact_claim_text": "41% of security leaders noted artificial intelligence incidents by late 2024.",
  "source_family": "market_statistic",
  "source_url_or_citation": "Claims ledger source pointer: VAULTMESH_RESEARCH_CLAIMS_LEDGER_NORMALIZED_V1 (row VM-CLAIM-004); source title “AI Incident Trends 2024” is unspecified.",
  "source_artifact_location": "not_retrieved",
  "retrieval_date": "2026-05-03",
  "custody_status": "source_unavailable",
  "evidence_mechanism": "source_url_and_retrieval_note",
  "reviewer": "codex_batch_001",
  "decision": "source_inadequate",
  "remaining_limits": ["Source not retrieved.", "Statistic not verified.", "Respondent group and wording not verified.", "Do not publish as fact."],
  "claim_upgrade_authorized": false,
  "public_claim_authorized": false
}
