{
  "record_id": "SOURCE_REFRESH_RECORD_VM_CLAIM_002",
  "classification": "INTERNAL_ONLY",
  "publication_status": "do_not_publish",
  "execution_status": "not_authorized",
  "record_status": "reviewed_no_claim_upgrade",
  "claim_id": "VM-CLAIM-002",
  "exact_claim_text": "84% of organisations experienced API security incidents in the past 12 months.",
  "source_family": "market_statistic",
  "source_url_or_citation": "Claims ledger source pointer: VAULTMESH_RESEARCH_CLAIMS_LEDGER_NORMALIZED_V1 (row VM-CLAIM-002); candidate source is “Akamai 2024 API Security Report.”",
  "source_artifact_location": "not_retrieved",
  "retrieval_date": "2026-05-03",
  "custody_status": "source_unavailable",
  "evidence_mechanism": "source_url_and_retrieval_note",
  "reviewer": "codex_batch_001",
  "decision": "source_not_found",
  "remaining_limits": ["Source not retrieved.", "Statistic not verified.", "Do not publish as fact."],
  "claim_upgrade_authorized": false,
  "public_claim_authorized": false
}
