{
  "record_id": "SOURCE_REFRESH_RECORD_VM_CLAIM_005",
  "classification": "INTERNAL_ONLY",
  "publication_status": "do_not_publish",
  "execution_status": "not_authorized",
  "record_status": "reviewed_no_claim_upgrade",
  "claim_id": "VM-CLAIM-005",
  "exact_claim_text": "Two-thirds of organisations had incidents caused by uncontrolled AI agents by Q1 2026.",
  "source_family": "market_statistic",
  "source_url_or_citation": "Claims ledger source pointer: VAULTMESH_RESEARCH_CLAIMS_LEDGER_NORMALIZED_V1 (row VM-CLAIM-005); candidate source is “CSA April 2026 report.”",
  "source_artifact_location": "not_retrieved",
  "retrieval_date": "2026-05-03",
  "custody_status": "source_unavailable",
  "evidence_mechanism": "source_url_and_retrieval_note",
  "reviewer": "codex_batch_001",
  "decision": "source_not_found",
  "remaining_limits": ["Source not retrieved.", "Statistic not verified.", "Recent claim requires direct source custody before reuse.", "Do not publish as fact."],
  "claim_upgrade_authorized": false,
  "public_claim_authorized": false
}
