{
  "record_id": "SOURCE_REFRESH_RECORD_VM_CLAIM_011",
  "classification": "INTERNAL_ONLY",
  "publication_status": "do_not_publish",
  "execution_status": "not_authorized",
  "record_status": "reviewed_no_claim_upgrade",
  "claim_id": "VM-CLAIM-011",
  "exact_claim_text": "VaultMesh labs map to OWASP Top 10 and MITRE ATT&CK techniques, ensuring coverage of known threat patterns.",
  "source_family": "api_security_reference",
  "source_url_or_citation": "Claims ledger source pointer: VAULTMESH_RESEARCH_CLAIMS_LEDGER_NORMALIZED_V1 (row VM-CLAIM-011); claimed mapping references OWASP Top 10 2021 and MITRE ATT&CK.",
  "source_artifact_location": "not_retrieved",
  "retrieval_date": "2026-05-03",
  "custody_status": "source_unavailable",
  "evidence_mechanism": "source_url_and_retrieval_note",
  "reviewer": "codex_batch_001",
  "decision": "source_inadequate",
  "remaining_limits": ["Framework sources not retrieved in this lane.", "Internal crosswalk not verified.", "Ensuring coverage language must be rewritten before use.", "Do not publish as fact."],
  "claim_upgrade_authorized": false,
  "public_claim_authorized": false
}
